{
  "id": "019_exact_balance_due",
  "description": "Payment of exactly the amount due. Outstanding becomes exactly 0; tranche becomes paid; no parent_credit created.",
  "category": "boundary",
  "tags": ["boundary", "exact_match"],
  "given": {
    "tenantId": "t1",
    "parent": {"id": "par-001", "name": "Test Parent"},
    "students": [{"id": "stu-001", "parentId": "par-001", "gradeLevel": "1ap", "paymentPlan": "tranches"}],
    "ledgerEntries": [
      {
        "id": "led-1", "parentId": "par-001", "studentId": "stu-001",
        "category": "tuition", "amount": 3333333, "type": "charge",
        "sourceType": "installment", "sourceId": "ins-1",
        "actorId": "u1", "actorName": "Alice",
        "at": "2026-01-15T10:00:00Z",
        "description": "T1 (odd amount)"
      }
    ],
    "installments": [
      {
        "id": "ins-1", "parentId": "par-001", "studentId": "stu-001",
        "category": "tuition", "label": "T1",
        "amountDue": 3333333, "amountPaid": 0, "amountPending": 0,
        "dueDate": "2026-09-15", "status": "unpaid"
      }
    ],
    "payments": [],
    "academicYearStartYear": 2025
  },
  "when": {
    "type": "allocatePayment",
    "paymentAmount": 3333333,
    "category": "tuition",
    "paymentStatus": "paid",
    "paymentId": "pay-001"
  },
  "then": {
    "totalOutstanding": 0,
    "totalPaid": 3333333,
    "totalUnallocatedCredit": 0
  }
}
