{
  "id": "001_simple_payment",
  "description": "Single cash payment of 25,000 DZD against a 100,000 DZD tuition charge. Verifies the canonical balance replay + waterfall allocation produces the same outstanding/paid totals on both engines.",
  "category": "waterfall",
  "tags": ["payment", "cash", "partial"],
  "given": {
    "tenantId": "t1",
    "parent": {"id": "par-001", "name": "Test Parent"},
    "students": [{"id": "stu-001", "parentId": "par-001", "gradeLevel": "1ap", "paymentPlan": "tranches"}],
    "ledgerEntries": [
      {
        "id": "led-1", "parentId": "par-001", "studentId": "stu-001",
        "category": "tuition", "amount": 10000000, "type": "charge",
        "sourceType": "installment", "sourceId": "ins-1",
        "actorId": "u1", "actorName": "Alice",
        "at": "2026-01-15T10:00:00Z",
        "description": "Tuition tranche 1"
      }
    ],
    "installments": [
      {
        "id": "ins-1", "parentId": "par-001", "studentId": "stu-001",
        "category": "tuition", "label": "Tranche 1",
        "amountDue": 10000000, "amountPaid": 0, "amountPending": 0,
        "dueDate": "2026-09-15", "status": "unpaid"
      }
    ],
    "payments": [],
    "academicYearStartYear": 2025
  },
  "when": {
    "type": "allocatePayment",
    "paymentAmount": 2500000,
    "category": "tuition",
    "paymentStatus": "paid",
    "paymentId": "pay-001"
  },
  "then": {
    "totalOutstanding": 7500000,
    "totalPaid": 2500000
  }
}
