{
  "id": "023_sync_round_trip_desktop_to_android",
  "description": "Sync round-trip: desktop writes a parent_credit adjustment → JSON → Android reads it → computes parent summary. The summary's totalUnallocatedCredit MUST equal the original adjustment amount.",
  "category": "sync_round_trip",
  "tags": [
    "sync",
    "round_trip",
    "parent_credit"
  ],
  "given": {
    "tenantId": "t1",
    "parent": {
      "id": "par-001",
      "name": "Test Parent"
    },
    "students": [],
    "ledgerEntries": [
      {
        "id": "led-1",
        "parentId": "par-001",
        "studentId": null,
        "category": "parent_credit",
        "amount": -5000000,
        "type": "adjustment",
        "sourceType": "adjustment",
        "sourceId": "adj-1",
        "actorId": "u1",
        "actorName": "Alice",
        "at": "2026-01-15T10:00:00Z",
        "description": "Previous year overpayment",
        "metadata": {
          "origin": "previous_year_overpayment",
          "autoAbsorb": true
        }
      }
    ],
    "installments": [],
    "payments": [],
    "academicYearStartYear": 2025
  },
  "when": {
    "type": "computeParentSummary",
    "parentId": "par-001"
  },
  "then": {
    "totalOutstanding": -5000000,
    "totalPaid": 0,
    "totalCharged": 0,
    "totalUnallocatedCredit": -5000000
  }
}
