{
  "id": "021_complex_sequence_payment_then_refund_then_repay",
  "description": "Complex operation sequence: charge → payment → refund → re-payment. Verifies that after refund + re-payment, the final state matches a fresh payment of (original - refunded) amount.",
  "category": "complex_sequence",
  "tags": ["complex", "refund", "repay"],
  "given": {
    "tenantId": "t1",
    "parent": {"id": "par-001", "name": "Test Parent"},
    "students": [{"id": "stu-001", "parentId": "par-001", "gradeLevel": "1ap", "paymentPlan": "tranches"}],
    "ledgerEntries": [
      {
        "id": "led-1", "parentId": "par-001", "studentId": "stu-001",
        "category": "tuition", "amount": 10000000, "type": "charge",
        "sourceType": "installment", "sourceId": "ins-1",
        "actorId": "u1", "actorName": "Alice",
        "at": "2026-01-15T10:00:00Z",
        "description": "T1"
      }
    ],
    "installments": [
      {
        "id": "ins-1", "parentId": "par-001", "studentId": "stu-001",
        "category": "tuition", "label": "T1",
        "amountDue": 10000000, "amountPaid": 0, "amountPending": 0,
        "dueDate": "2026-09-15", "status": "unpaid"
      }
    ],
    "payments": [],
    "academicYearStartYear": 2025
  },
  "when": {
    "type": "syncRoundTrip",
    "operations": [
      {"type": "allocatePayment", "paymentAmount": 5000000, "category": "tuition", "paymentStatus": "paid", "paymentId": "pay-1"},
      {"type": "revertPaymentAllocation", "reversalAmount": 5000000, "category": "tuition", "originalWasPending": false},
      {"type": "allocatePayment", "paymentAmount": 3000000, "category": "tuition", "paymentStatus": "paid", "paymentId": "pay-2"}
    ]
  },
  "then": {
    "totalOutstanding": 7000000,
    "totalPaid": 3000000
  }
}
